{
    "url": "https://2e.aonprd.com/Feats.aspx?ID=2692",
    "name": "Entwined Energy Ki",
    "source": "Pathfinder #166",
    "rarity": "Uncommon",
    "traits": [
        "Monk"
    ],
    "level": 10,
    "prereq": "&Mdash;",
    "summary": "You can transform your inner power into a type of energy to empower your ki abilities.",
    "description": "You can transform your inner power into a type of energy to empower your ki abilities. When you gain this feat, choose either acid, cold, electricity, fire, or sonic damage. When you cast ki blast, you can choose to have the spell deal the type of damage you chose instead of force damage. When you cast ki form or ki strike, add the type of damage you chose to the list of damage types you can select for the spell.\n\nSpecial At the GM's discretion, this feat can alter other ki spells.TraitsUncommon: Something of uncommon rarity requires special training or comes from a particular culture or part of the world. Some character choices give access to uncommon options, and the GM can choose to allow access for anyone. Less is known about uncommon creatures than common creatures. They typically can't be summoned. The DC of Recall Knowledge checks related to these creature is increased by 2.\n\nFeatsSource Pathfinder #166: Despair on Danger Island pg. 74\nThe player characters might learn some of these techniques from friends and rivals during their stay on Bonmu, allowing them to select the feats the next time they would gain a feat. Surviving combat against Syu Tak-nwa allows the characters to take the three witch feats, while defeating or impressing the Ahmoza twins allows them to take Entwined Energy Ki. Lighting the candles and praying in the temple of Irori's prayer room (area A8) gives them access to Wronged Monk's Wrath.\n\n\nRelated Feats: Syu Tak-Nwa's Deadly Hair, Syu Tak-Nwa's Hexed Locks, Syu Tak-Nwa's Skillful Tresses, Wronged Monk's Wrath",
    "economy": "none",
    "trigger": ""
}