{
    "url": "https://2e.aonprd.com/Feats.aspx?ID=3575",
    "name": "Powder Punch Stance",
    "source": "Pathfinder #178",
    "rarity": "Uncommon",
    "traits": [
        "Archetype",
        "Stance"
    ],
    "level": 2,
    "prereq": "Martial Artist Dedication",
    "summary": "You infuse your handwraps with black powder.",
    "description": "You infuse your handwraps with black powder. On your first melee Strike each round with an unarmed attack, knuckle duster, or black powder knuckle duster, you deal an additional 1 fire damage. If you critically succeed at an attempt to Shove while in this stance, the target is pushed back an additional 5 feet.Powder Punch Stance Leads To...Black Powder Flash, Thunder ClapTraitsArchetype: This feat belongs to an archetype.\n\nStance: A stance is a general combat strategy that you enter by using an action with the stance trait, and that you remain in for some time. A stance lasts until you get knocked out, until its requirements (if any) are violated, until the encounter ends, or until you enter a new stance, whichever comes first. After you use an action with the stance trait, you canâ€™t use another one for 1 round. You can enter or be in a stance only in encounter mode.Uncommon: Something of uncommon rarity requires special training or comes from a particular culture or part of the world. Some character choices give access to uncommon options, and the GM can choose to allow access for anyone. Less is known about uncommon creatures than common creatures. They typically can't be summoned. The DC of Recall Knowledge checks related to these creature is increased by 2.Black Powder FeatsSource Pathfinder #178: Punks in a Powderkeg pg. 55\nIf the characters agree to Nixbrix's challenge to defeat Bitey or otherwise impress the gang leader, he offers to teach them a few tricks. The characters gain access to the feats in the Black-Powder Berserkers section on page 79, even if they aren't from Alkenstar or the Mana Wastes, though they still must meet the feats' other prerequisites to take them.\n\nRelated Feats: Black Powder Flash, Inured to Alchemy, Pain Tolerance, Thunder Clap",
    "economy": "none",
    "trigger": ""
}