{
    "url": "https://2e.aonprd.com/Feats.aspx?ID=1203",
    "name": "Mature Trained Companion",
    "source": "Pathfinder #152",
    "rarity": "Uncommon",
    "traits": [
        "Archetype"
    ],
    "level": 6,
    "prereq": "Animal Trainer Dedication",
    "summary": "Your animal companion grows up, becoming a mature animal companion.",
    "description": "Your animal companion grows up, becoming a mature animal companion. Increase its proficiency rank in Performance to expert instead of one of the three skill increases for mature. It gains the Mesmerizing Performance advanced maneuver, rather than the normal advanced maneuver for its type. Mesmerizing Performance\n    UncommonConcentrateEmotion\nSource Pathfinder #152: Legacy of the Lost God pg. 76\nRequirements The companion’s last action was a successful Performance check to Perform.\n\n------\n\nThe companion maintains its performance to captivate a single target within 30 feet that witnessed its successful performance. The target must attempt a Will save.\n\n\nSuccess The target is unaffected and temporarily immune for 1 hour\nFailure The target is fascinated by the companion for its next action and then is temporarily immune for 1 hour.\nCritical Failure The target is fascinated by the companion for 1 round. While it remains fascinated, it can’t use reactions.\n\n------\n\nMature Trained Companion Leads To...Splendid CompanionTraitsArchetype: This feat belongs to an archetype.\n\nUncommon: Something of uncommon rarity requires special training or comes from a particular culture or part of the world. Some character choices give access to uncommon options, and the GM can choose to allow access for anyone. Less is known about uncommon creatures than common creatures. They typically can't be summoned. The DC of Recall Knowledge checks related to these creature is increased by 2.",
    "economy": "1-action",
    "trigger": ""
}