{
    "url": "https://2e.aonprd.com/Feats.aspx?ID=1087",
    "name": "Everstand Stance",
    "source": "Character Guide",
    "rarity": "Uncommon",
    "traits": [
        "Champion",
        "Fighter",
        "Stance"
    ],
    "level": 1,
    "prereq": "&Mdash;",
    "summary": "You brace your shield with both hands, enhancing its potential for both offense and defense.",
    "description": "You brace your shield with both hands, enhancing its potential for both offense and defense. When in this stance, you wield the shield with both hands. When wielding a shield this way, increase the weapon damage die of the shield’s boss or spikes by one step, and increase the shield’s Hardness by 2 when using the Shield Block reaction.Archetype Use\n\nThis feat can be used for one or more Archetypes in addition to the listed Classes. When selected this way, the feat is not considered to have its class traits.Everstand Stance Leads To...Everstand StrikeTraitsStance: A stance is a general combat strategy that you enter by using an action with the stance trait, and that you remain in for some time. A stance lasts until you get knocked out, until its requirements (if any) are violated, until the encounter ends, or until you enter a new stance, whichever comes first. After you use an action with the stance trait, you can’t use another one for 1 round. You can enter or be in a stance only in encounter mode.\n\nUncommon: Something of uncommon rarity requires special training or comes from a particular culture or part of the world. Some character choices give access to uncommon options, and the GM can choose to allow access for anyone. Less is known about uncommon creatures than common creatures. They typically can't be summoned. The DC of Recall Knowledge checks related to these creature is increased by 2.Knights of Lastwall Class FeatsSource Character Guide pg. 90 2.0\nThe following class feats are available to Knights of Lastwall. Those with the champion trait are champion class feats. Those with both the champion and fighter traits are both champion class feats and fighter class feats; when you take one of these feats, it loses the trait that doesn’t apply to your class.\n\nRelated Feats: Everstand Strike, Impassable Wall Stance, Light of Revelation, Sun Blade",
    "economy": "1-action",
    "trigger": ""
}